{"export_attestation":{"actor":"validator:nepsis.interop_bundle@0.2.0","created_at":"2026-07-09T15:00:00.000Z","event_hash":"1618848122bf77d6550a58ce8cc5111ed43d4634ed3cd3ee0b6ea31e02a03799","event_schema_version":"nepsis.audit_event@0.1.0","event_type":"export_created","idempotency_key":"interop_golden_001","payload":{"artifact_root":"abb9288986fbc48e766f03f5df5bb23f4814d54002c5fe040365cf96a8a33cbc","intent_hash":"51cd8f465a04e1a2dfc7068fe80415070f97d3815d0c1937b9cceaf2c2458970","interop_bundle_version":"nepsis.interop_bundle@0.2.0","markdown_hash":"2cc8b8cd826af491b6226912a933e455ab11fe20988e6fe1075264d0c76d4160","profile":"full","redact_artifact_hashes":[],"redact_sequences":[],"subject_audit_end_sequence":19,"subject_audit_tip":"55f191346e8205a6371e64ed13dc23c7461035beb9376a0adf85434c9d013a09","subject_hash":"1391d394cc0f0b2738c959e1e8e59490290e6f25928dc002707f251816da4b62"},"payload_hash":"c6147a7efaa84572bf486d7302d48bf944889af2aa45a4a4bb7b2ad412c7505a","prev_event_hash":"55f191346e8205a6371e64ed13dc23c7461035beb9376a0adf85434c9d013a09","provenance_class":"validator","sequence":20,"session_id":"session_markdown_golden"},"interop_bundle_version":"nepsis.interop_bundle@0.2.0","subject":{"artifact_root":"abb9288986fbc48e766f03f5df5bb23f4814d54002c5fe040365cf96a8a33cbc","artifact_rows":[{"artifact":{"discriminator_id":"disc_marker","limitations":["Synthetic golden fixture."],"observation_id":"observation_negative","observation_schema_version":"nepsis.observation@0.1.0","observed_at":"2026-07-09T15:01:00.000Z","outcome_id":"negative","session_id":"session_markdown_golden","source_class":"operator_recorded_test","source_event_hashes":["1d764a932363ca5390c168909c64c1715cf500745606fedd24c1aeac1b58b823"],"source_ref":"fixture:negative"},"artifact_hash":"08d27ad7fe5f8232472b7816a08d2ac6c88fed4028b41b036331d68fe16d655c","included":true,"roles":["observation"],"schema_version":"nepsis.observation@0.1.0"},{"artifact":{"absolute_fit_ppm":420000,"denominator_status":"adequate","ess_fraction_ppm":662161,"kernel_policy_hash":"3cce5c427d8fbf759dc1ac79d0c178e7b5fe13171b314c79df85829372ff6fef","kernel_policy_version":"nepsis.inference_kernel@0.1.0","minimum_absolute_fit_ppm":10000,"observation_hash":"08d27ad7fe5f8232472b7816a08d2ac6c88fed4028b41b036331d68fe16d655c","population_update_schema_version":"nepsis.population_update@0.1.0","posterior_population_hash":"7e066689ab26ea321c8269b50781df9c2bf257e8866506e0bc59c39f0930a130","predictions_hash":"dc5d7699c39defa490cee999c1864a6907f9cfc36d92a188942622476951519b","pretest_population_hash":"a4f1661ec833d3632722a65c8f7e84d287216d4028fa10b7bd14f32f2f52b99d","rejuvenation_status":"not_requested","resample_ess_threshold_ppm":500000,"resampled":false,"result_population_hash":"7e066689ab26ea321c8269b50781df9c2bf257e8866506e0bc59c39f0930a130","rows":[{"likelihood_ppm":100000,"particle_id":"particle_hazard","posterior_weight_ppm":142857,"prior_weight_ppm":600000,"unnormalized_weight":60000000000},{"likelihood_ppm":900000,"particle_id":"particle_low_risk","posterior_weight_ppm":857143,"prior_weight_ppm":400000,"unnormalized_weight":360000000000}],"seed":"markdown_seed_001","session_id":"session_markdown_golden","source_event_hashes":["1d764a932363ca5390c168909c64c1715cf500745606fedd24c1aeac1b58b823","7081eb3e7d8515de0cef94c4047e56ba3fbc7accf773dd1a6e5a62143e2033e6","be0f7e8423622e4826bc76f95bf6c0c018c860fbfd4976746ad6ca3658f47867"],"update_id":"update_ac8956b6abcb6bf698e2"},"artifact_hash":"249db1e8c687ab58b4b34d7b898b95fbf80c669dcb3eb1004c8d4e696177956b","included":true,"roles":["update"],"schema_version":"nepsis.population_update@0.1.0"},{"artifact":{"acceptance_id":"acceptance_99d70aab9f5a84c2c9dd","acknowledged_gap_ids":[],"calibration_acceptance_schema_version":"nepsis.calibration_acceptance@0.1.0","calibration_cycle_id":"calibration_56aa6c1db2b9789d8e1a","confirmed":true,"created_at":"2026-07-09T15:00:00.000Z","discriminator_id":"disc_marker","disposition":"manual_override","operator_actor":"operator:trent","operator_rationale":"Explicit synthetic Markdown calibration.","outcome_ids":["negative","positive"],"override_paths":["likelihood_rows/particle_hazard/negative/likelihood_ppm","likelihood_rows/particle_hazard/positive/likelihood_ppm","likelihood_rows/particle_low_risk/negative/likelihood_ppm","likelihood_rows/particle_low_risk/positive/likelihood_ppm","prior_rows/particle_hazard/weight_ppm","prior_rows/particle_low_risk/weight_ppm"],"selected_likelihood_rows":[{"likelihood_ppm":100000,"outcome_id":"negative","particle_id":"particle_hazard"},{"likelihood_ppm":900000,"outcome_id":"positive","particle_id":"particle_hazard"},{"likelihood_ppm":900000,"outcome_id":"negative","particle_id":"particle_low_risk"},{"likelihood_ppm":100000,"outcome_id":"positive","particle_id":"particle_low_risk"}],"selected_prior_rows":[{"particle_id":"particle_hazard","weight_ppm":600000},{"particle_id":"particle_low_risk","weight_ppm":400000}],"session_id":"session_markdown_golden","source_artifact_hashes":[],"source_event_hashes":["074123dd6198b2771729e66d4559a319eb1ccc29d23b25c07d569bf2dbc7b85b"]},"artifact_hash":"5eb6619382c4eb7d0f22569edff234924c280992a0a48767cfa207bb276b9c01","included":true,"roles":["acceptance"],"schema_version":"nepsis.calibration_acceptance@0.1.0"},{"artifact":{"checkpoint_kind":"posttest","decision_id":"decision_001","generation":1,"kernel_policy_hash":"3cce5c427d8fbf759dc1ac79d0c178e7b5fe13171b314c79df85829372ff6fef","kernel_policy_version":"nepsis.inference_kernel@0.1.0","members":[{"particle_id":"particle_hazard","weight_ppm":142857},{"particle_id":"particle_low_risk","weight_ppm":857143}],"parent_population_hashes":["a4f1661ec833d3632722a65c8f7e84d287216d4028fa10b7bd14f32f2f52b99d"],"particle_refs":[{"artifact_hash":"7f6cf2579e0162a95147d2a64c3ad9d9a800d882cfef98d7bd4bc47958f50a33","particle_id":"particle_hazard"},{"artifact_hash":"a7f0b601a35a43fc96210322d301bd015a6fa09491e444cf044233ae79730914","particle_id":"particle_low_risk"}],"population_id":"population_ae61aa9b515416a53807","population_snapshot_schema_version":"nepsis.population_snapshot@0.1.0","seed":"markdown_seed_001","session_id":"session_markdown_golden","source_event_hashes":["1d764a932363ca5390c168909c64c1715cf500745606fedd24c1aeac1b58b823","7081eb3e7d8515de0cef94c4047e56ba3fbc7accf773dd1a6e5a62143e2033e6","be0f7e8423622e4826bc76f95bf6c0c018c860fbfd4976746ad6ca3658f47867"],"status":"active"},"artifact_hash":"7e066689ab26ea321c8269b50781df9c2bf257e8866506e0bc59c39f0930a130","included":true,"roles":["posterior_population","result_population"],"schema_version":"nepsis.population_snapshot@0.1.0"},{"artifact":{"blue_utilities":[{"action_id":"act_observe","utility_microunits":-400},{"action_id":"act_treat","utility_microunits":800}],"frame_id":"frame_initial","generation":0,"hypothesis":"A delay-sensitive hazard is present.","parent_particle_ids":[],"particle_id":"particle_hazard","particle_schema_version":"nepsis.particle@0.1.0","red_hazards":[{"blocked_action_ids":["act_observe"],"description":"Observation may delay necessary treatment.","hazard_id":"hazard_delay","protected":true,"severity":"ruin","status":"unresolved","waivable":false}],"session_id":"session_markdown_golden","source_event_hashes":["000879d8a176c3d2753a1f06e4b9999f829b03498c0ea30275f30b0e6e708b34"]},"artifact_hash":"7f6cf2579e0162a95147d2a64c3ad9d9a800d882cfef98d7bd4bc47958f50a33","included":true,"roles":["particle_artifact"],"schema_version":"nepsis.particle@0.1.0"},{"artifact":{"actions":[{"action_id":"act_observe","label":"Observe"},{"action_id":"act_treat","label":"Treat"}],"assumptions":["The observation source is available."],"blue_objectives":[{"description":"Choose the greatest expected reversible benefit.","objective_id":"objective_expected_benefit","utility_unit":"decision_utility_microunits"}],"decision_id":"decision_001","denominator":"One current decision under unresolved high-consequence risk.","discriminators":[{"discriminator_id":"disc_marker","outcome_ids":["negative","positive"],"question":"Is the marker positive?","source_class":"operator_recorded_test"}],"frame_id":"frame_initial","frame_schema_version":"nepsis.frame@0.1.0","question":"Treat now or observe?","red_constraints":[{"blocked_action_ids":["act_observe"],"constraint_id":"constraint_delay_harm","description":"Do not observe if delay could cause irreversible harm.","severity":"ruin","status":"unresolved","waivable":false}],"session_id":"session_markdown_golden","source_event_hashes":["000879d8a176c3d2753a1f06e4b9999f829b03498c0ea30275f30b0e6e708b34"],"time_horizon":"Next twenty-four hours."},"artifact_hash":"936451c51f537992e3f17a1da45f7ad700995c0b1d77f48f8c16c8123b35933b","included":true,"roles":["frame"],"schema_version":"nepsis.frame@0.1.0"},{"artifact":{"edges":[],"frame_lineage_schema_version":"nepsis.frame_lineage@0.1.0","nodes":[{"artifact_hash":"936451c51f537992e3f17a1da45f7ad700995c0b1d77f48f8c16c8123b35933b","frame_id":"frame_initial","source_event_hash":"000879d8a176c3d2753a1f06e4b9999f829b03498c0ea30275f30b0e6e708b34","state":"active"}],"roots":["frame_initial"],"session_id":"session_markdown_golden","source_event_hashes":["000879d8a176c3d2753a1f06e4b9999f829b03498c0ea30275f30b0e6e708b34"]},"artifact_hash":"9851375392ffb5a947fb06f98536a2f0ac0b3e7afe1b3594204ca71dc7b7253b","included":true,"roles":["frame_lineage"],"schema_version":"nepsis.frame_lineage@0.1.0"},{"artifact":{"checkpoint_kind":"initial","decision_id":"decision_001","generation":0,"kernel_policy_hash":"3cce5c427d8fbf759dc1ac79d0c178e7b5fe13171b314c79df85829372ff6fef","kernel_policy_version":"nepsis.inference_kernel@0.1.0","members":[{"particle_id":"particle_hazard","weight_ppm":600000},{"particle_id":"particle_low_risk","weight_ppm":400000}],"parent_population_hashes":[],"particle_refs":[{"artifact_hash":"7f6cf2579e0162a95147d2a64c3ad9d9a800d882cfef98d7bd4bc47958f50a33","particle_id":"particle_hazard"},{"artifact_hash":"a7f0b601a35a43fc96210322d301bd015a6fa09491e444cf044233ae79730914","partic